"list","date","vendor","product","price","usd","rate","cat","subcat","subsubcat","feedback","from","to"
"2014-12-04__kdk1PMpwNP.html","2014-12-04","cyberzen","BYPASS ANY SMS PHONE VERIFICATION EASY WITHOUT SIM CARD",0.01091256,4.028371524,369.15,"Data","Pirated","NA"," Feedbacks: 3/5 vendor had a internet connection problem and sent me a new link so problem solved 69 days ago anon ~5/5, 6~10 deals 5/5 184 days ago anon ~5/5, 6~10 deals ","uk, usa philippines","no info"
"2014-12-05__CBFtPTYcac.html","2014-12-05","ThreeKings","Hubei Dianabol 50 tabs [10mg/tab]",0.05401026,20.3100181704,376.04,"Drugs","Steroids","NA"," Feedbacks: 5/5 all good :) 19 days ago anon 3~5 deals ","uk, usa philippines","worldwide"
"2014-12-05__Ej2LhZghlh.html","2014-12-05","NotoSeller","Tiny4K.com - [LIFETIME PORN PREMIUM ACCOUNT]",0.02690848,10.1186648192,376.04,"Data","Accounts","NA"," Feedbacks: 5/5 account works just perfect;) trusted vendor! 14 days ago anon ~5/5, 3~5 deals 5/5 super fast! 38 days ago anon ~5/5, 15~25 deals 5/5 Great vendor, thanks! :) 44 days ago anon 5.00/5, 40~55 deals 5/5 Works like a charm! Quick delivery. 46 days ago anon 3~5 deals 5/5 5/5 49 days ago anon ~5/5, 25~40 deals 5/5 fast! 52 days ago anon ~5/5, 15~25 deals ","uk, usa philippines","no info"
"2014-12-05__R7EiGcwR3e.html","2014-12-05","DutchTruthTeller","25x HEINEKEN TOP CLASS DUTCH XTC PILL 200-220MG MDMA",0.3,112.812,376.04,"Drugs","Ecstasy","Pills"," Feedbacks: 5/5 8 days to receve order,extra pills like he say. i recommend it. 27 days ago anon ~3/5, 3~5 deals 5/5 top seller! 29 days ago anon ~5/5, 6~10 deals 5/5 FE for extras and good feedback! Will update! 33 days ago anon ~5/5, 10~15 deals 5/5 Excellent stealth , couple extra , will use again :) 36 days ago anon ~5/5, 6~10 deals ","uk, usa philippines","world  except australia"
"2014-12-05__xi5708CNlt.html","2014-12-05","MagicHat","Rayban Mini Wayfarer Sunglasses",0.03191574,12.0015948696,376.04,"Counterfeits","Accessories","NA"," Feedbacks: 5/5 Exactly as advertised. Fantastic 43 days ago anon 5.00/5, 40~55 deals 5/5 perfect 122 days ago anon ~5/5, 25~40 deals ","uk, usa philippines","worldwide"
"2014-12-05__xYcLVqJrbs.html","2014-12-05","accept","CANNABIS / BHO / WAX / OIL / SHATTER: 1/2g. 2-4 DAY MAIL",0.07453465,28.028009786,376.04,"Drugs","Cannabis","Concentrates"," Feedbacks: 5/5 Received the package in 3 days. It was very stealthy. The product was a bit sticky, but the end result amazing. 0 days ago anon ~5/5, 10~15 deals ","uk, usa philippines","usa"
"2014-12-06__W1PrrVUtbP.html","2014-12-06","RastainPeace","30ml GBL (German Made, 99.9%) UK to UK",0.099,37.02798,374.02,"Drugs","Dissociatives","GBL"," Feedbacks: 5/5 excellent stealth and shipping time 13 days ago anon 5.00/5, 70~100 deals 5/5 Super fast super strong brilliant stealth 15 days ago anon ~5/5, 6~10 deals 5/5 come in 2 days, the strongest shit i have had nice1 16 days ago anon ~5/5, 6~10 deals ","uk, usa philippines","no info"
"2014-12-06__DmlpUnZPUR.html","2014-12-06","koptevo","Viagra generic 100mg x 100 tablets",0.26367655,98.620303231,374.02,"Drugs","Prescription","NA"," Feedbacks: 5/5 Amazing deal ! The pills were not shipped from the country specified however. 15 days ago anon ~5/5, 10~15 deals 5/5 Fast, reliable, excellent all around. Will repeat. 16 days ago anon ~5/5, 10~15 deals 5/5 Perfect and fast! 18 days ago anon ~5/5, 10~15 deals 5/5 Top quality! Superb fast shipping! Thx 18 days ago anon 5.00/5, 25~40 deals 5/5 Quick shipping. Haven't tried but looks legit. 22 days ago anon ~5/5, 6~10 deals 5/5 Kotevo was great in making sure my product was packaged safely, and with no breakage issues. Timing of shipping was no issue ei 26 days ago anon 5.00/5, 25~40 deals 5/5 Excellent vendor. Great quality pills. Great communication. 30 days ago anon ~5/5, 10~15 deals 5/5 BONER by mail. BOING!!! 43 days ago anon ~5/5, 10~15 deals 5/5 all good 43 days ago anon ~5/5, 15~25 deals 5/5 5/5 speedy delivery. Everything is like its described in the description.. Will do business with this vendor again. 45 days ago anon ~5/5, 15~25 deals 5/5 Top quality pills. Great vendor. Thank you Koptevo! 79 days ago anon ~5/5, 10~15 deals 5/5 Good communication. Product as described (legit, in blister packs). Would do business with again. 102 days ago anon 5.00/5, 25~40 deals 5/5 thanks , had a boner by the time i opened it. def works 107 days ago anon ~5/5, 15~25 deals 5/5 excellent vendor thanks! 114 days ago anon ~5/5, 25~40 deals 5/5 #1 Boner 118 days ago anon ~5/5, 6~10 deals 5/5 Good 122 days ago anon ~5/5, 6~10 deals 5/5 Perfect transaction, fast as hell 124 days ago anon ~5/5, 15~25 deals 5/5 Good communication, fast shipping. 126 days ago anon 1~2 deals 5/5 Couldn't have asked for better service. I unreservedly recommend this vendor! 126 days ago anon ~5/5, 40~55 deals 5/5 Great! Ordered Saturday received Friday, adequate stealth, everything as advertised. FE early! Well Done. 127 days ago anon ~5/5, 15~25 deals ","uk, usa philippines","no info"
"2014-12-06__P3MKSpCwXB.html","2014-12-06","diamonddweller","Methandrostenolone/Dinabol/Dbol 10mg with labtest. 500 x 10mg tabs.",0.46731467,174.7850328734,374.02,"Drugs","Steroids","NA"," Feedbacks: 5/5 Fast delivery, safe packaging 64 days ago anon 3~5 deals 5/5 pro 109 days ago anon 5.00/5, 15~25 deals 5/5 Good stealth,fast shipping! 152 days ago anon ~5/5, 25~40 deals 5/5 177 days ago anon ~5/5, 3~5 deals 5/5 Fast shipping, good stealth and good tabs. THX 184 days ago anon ~5/5, 10~15 deals 5/5 198 days ago anon ~5/5, 15~25 deals 5/5 Product well received, already have made an other order. Very good seller. 199 days ago anon ~5/5, 1~2 deals 5/5 And again a perfect transaction. Recommended vendor. 5+ 225 days ago anon ~5/5, 3~5 deals ","uk, usa philippines","world"
"2014-12-06__ro9iLyCJSj.html","2014-12-06","PharmacyKing","Ritalin 10mg (Methylphenidate Hydrochloride) Novartis Brand 200 pills",0.69461141,259.7985595682,374.02,"Drugs","Prescription","NA"," Feedbacks: 5/5 Exactly as described and had an extra tab as well 6 days ago anon 5.00/5, 25~40 deals ","uk, usa philippines","world "
"2014-12-07__bVttDzRdZh.html","2014-12-07","Perron","6-APB [1 Gram]",0.10674637,39.9508964362,374.26,"Drugs","Ecstasy","MDA"," Feedbacks: 5/5 Product arrived UK in 5 days, On weight and vendor was prompt with shipping. 37 days ago anon 5.00/5, 25~40 deals 5/5 super fast delivery, good comunication, 10+ 37 days ago anon ~5/5, 1~2 deals 5/5 ...cont. MDMA and 6APB exactly as shown in his pictures. Haven't tested. Very friendly. 37 days ago anon ~5/5, 3~5 deals ","uk, usa philippines","europe"
"2014-12-07__hjlhYuFq2a.html","2014-12-07","NORWEGIANcom","NORWAY - Pure LSD 150µg - 1 blotter - from Amsterdam - NEW",0.06779751,25.3738960926,374.26,"Drugs","Psychedelics","LSD"," Feedbacks: 5/5 fantastisk vendor! fantastisk LSD! 15 days ago anon 1~2 deals 5/5 Quick delivery, acid definitely up to par. Very good stealth. Returning customer, will buy from this vendor again. 17 days ago anon 1~2 deals 5/5 Rask leveringstid og god stealth. Gleder meg til å prøve disse :) 17 days ago anon 6~10 deals ","uk and ireland","norway"
"2014-12-07__m6zm4MEV9J.html","2014-12-07","Hollands-Best","50x Blue Ghosts XTC Pills - 160MG",0.63685781,238.3504039706,374.26,"Drugs","Ecstasy","Pills"," Feedbacks: 5/5 Arrived, good stealth/packaging. 11 days ago anon 3~5 deals 5/5 17 days ago anon ~5/5, 10~15 deals 5/5 HB is up there with the best. Always great communication combined with a fast shipment. 18 days ago anon ~1/5, 25~40 deals 5/5 I FE'd in trust and the product arrived in 3 days. You just made my day !! 26 days ago anon ~5/5, 10~15 deals 5/5 FE 40 days ago anon 3~5 deals 5/5 FE'd will update 92 days ago anon ~5/5, 3~5 deals 5/5 very fun & happy to work with you 107 days ago anon 5.00/5, 25~40 deals ","uk and ireland","worldwide"
"2014-12-07__qYBMaoFwgf.html","2014-12-07","FlyingDutchmen","2GR SUPERB CRYSTAL COCAINE FROM COLOMBIA (90%+  UNCUT) - FREE SHIPPING",0.54333421,203.3482614346,374.26,"Drugs","Stimulants","Cocaine"," Feedbacks: 5/5 2 days ago anon ~5/5, 3~5 deals 5/5 This is great cola. Well worth the money. 2 days to uk 3 days ago anon ~5/5, 10~15 deals 5/5 great seller. the coke is as described , good communication, feel free to FE-worth the effort. and again-really gooooood co 7 days ago anon 3~5 deals 5/5 9 days ago anon ~5/5, 6~10 deals 5/5 quick and fair. Very good! 9 days ago anon 1~2 deals 5/5 Superb vendor, Excellent Stealth, Good Product..will be back. 27 days ago anon 3~5 deals ","uk and ireland","no info"
"2014-12-08__Eh45EFcsNM.html","2014-12-08","DrawkwarD","FOX Soccer 2Go Account [LIFETIME + FREEBIES]",0.04087082,14.7519137708,360.94,"Data","Accounts","NA"," Feedbacks: 5/5 30 days ago anon ~5/5, 10~15 deals 5/5 Works great... A++++++ 36 days ago anon ~5/5, 25~40 deals 5/5 Perfect :) 42 days ago anon 6~10 deals 5/5 Excellent 46 days ago anon ~5/5, 15~25 deals 5/5 61 days ago anon ~5/5, 25~40 deals 5/5 109 days ago anon ~5/5, 15~25 deals 5/5 Works great! 125 days ago anon ~5/5, 25~40 deals 5/5 Account works great! Great Vendor! 173 days ago anon ~5/5, 3~5 deals 5/5 best seller ever 176 days ago anon ~5/5, 15~25 deals 5/5 very fast and remarkably helpful to deal with. 190 days ago anon 3~5 deals 5/5 192 days ago anon 1~2 deals 5/5 the best 209 days ago anon 5.00/5, 40~55 deals ","uk, usa& worldwide","no info"
"2014-12-08__iBrhXeaCdg.html","2014-12-08","captainkirk","Smuggling, Caching and Hiding Ebooks Collection",0.00266214,0.9608728116,360.94,"Information","eBooks","NA"," Feedbacks: 5/5 4 days ago anon 25~40 deals 5/5 quick transaction a good vendor 18 days ago anon ~4/5, 3~5 deals 5/5 19 days ago anon ~5/5, 10~15 deals 5/5 Awesome once again. Always fast and easy. Thanks CaptKirk 19 days ago anon 3~5 deals 5/5 Looks Good, Interesting reads. Thanks 25 days ago anon ~5/5, 10~15 deals 5/5 Professional service A+ 27 days ago anon 5.00/5, 25~40 deals 5/5 Very fast, thanks. 33 days ago anon 1~2 deals 5/5 45 days ago anon 5.00/5, 40~55 deals 5/5 Rad little package of books. Thanks again CK! 74 days ago anon ~5/5, 25~40 deals 5/5 trusted vendor 87 days ago anon ~5/5, 15~25 deals 5/5 loads of ebooks for cheap 5/5 102 days ago anon ~5/5, 6~10 deals 5/5 Despite a few hiccups with agora being down, vendor came through in flying colors. Literature appears excellent and vendor is 136 days ago anon ~5/5, 6~10 deals ","uk, usa philippines","everywhere"
"2014-12-08__jf2q6M66TG.html","2014-12-08","OpenSource","Methadone 10MG X  20",0.40442167,145.9719575698,360.94,"Drugs","Opioids","Other"," Feedbacks: 5/5 10/10. The best. Couldn't ask for anything more. Perfect every time. 33 days ago anon 5.00/5, 55~70 deals 5/5 Great vendor! 55 days ago anon ~5/5, 6~10 deals ","uk, usa philippines","usa"
"2014-12-08__KwvcENbNVL.html","2014-12-08","listonishere","Oxy 50 OC 40 mg (Oxycontin 40mg)--Usa & Uk stock--",2.69614451,973.1463994394,360.94,"Drugs","Opioids","Oxycodone"," Feedbacks: 5/5 another great order from the man. I've ran out of good things to say about liston. so blahhh I'm happy!! 49 days ago anon ~5/5, 6~10 deals 5/5 liston is the man, came through once again with flying colors and even threw in a nice sample pack of his other products! 57 days ago anon ~5/5, 25~40 deals 1/5 Absolutely horrible! These are FAKE! Tested, do not have Oxycodone. Buy elsewhere. Obvious by price! Search this guy online, he 77 days ago anon ~5/5, 55~70 deals ","uk, usa philippines","usa , uk and worldwide"
"2014-12-08__MNMm98UKE7.html","2014-12-08","BudsNRoses","5 Gourmet Jumbo Moon Pops",0.139435,50.3276689,360.94,"Drugs","Cannabis","Edibles"," Feedbacks: 5/5 21 days ago anon 6~10 deals 5/5 Super fast shipping, haven't tried product yet but they look good. 35 days ago anon 6~10 deals 5/5 insanely fast shipping! you rock. wish the product was stronger though. 64 days ago anon ~5/5, 6~10 deals 5/5 great. FE'd early by mistake and got it quick as hell anyways. 67 days ago anon 3~5 deals 5/5 More of a good bud taste than cotton candy but hey I like the taste lol 101 days ago anon ~5/5, 15~25 deals ","uk, usa philippines","no info"
"2014-12-08__nyuZUrUekT.html","2014-12-08","farmacy41","[50x] Hydrocodone 10/325 (Norco)",1.22625827,442.6056599738,360.94,"Drugs","Opioids","Hydrocodone"," Feedbacks: 5/5 FE'd per request - will update on arrival 0 days ago anon ~5/5, 25~40 deals 5/5 This guy is the BEST. 6 days ago anon 3~5 deals 5/5 FE for the best vendor! Always super fast shipping, great product, and fantastic stealth! Most trusted vendor and happy to be a 8 days ago anon 3~5 deals 5/5 Very fast delivery and good product 10 days ago anon ~5/5, 15~25 deals 5/5 On target, yet again. Great stuff, great shipping. 13 days ago anon 4.83/5, 40~55 deals ","uk, usa philippines","usa"
"2014-12-08__saqcg0APRm.html","2014-12-08","PharmacyKing","Xanax 1mg (Alprazolam) Pfizer Brand",0.00408708,1.4751906552,360.94,"Drugs","Benzos","NA"," Feedbacks: 5/5 Order didn't go to plan and PK was helpful and fair. He agreed to a partial refund. Good vendor who stands by his service. 15 days ago anon 6~10 deals 5/5 great comms, slight hiccup on delivery but product as described 62 days ago anon ~5/5, 10~15 deals 3/5 Did not receive pfizer but marked 2mg bars that look like Alprox. No blisters so could have been UGL. Not a bad deal for the 74 days ago anon 5.00/5, 25~40 deals ","uk, usa philippines","world "
"2014-12-08__SXggDPywc6.html","2014-12-08","ThreeKings","Genesis T3+T4 30+120mcg/tab [100 tabs]",0.1011957,36.525575958,360.94,"Drugs","Weight loss","NA"," Feedbacks: 5/5 Received in US in 10 days. Great Product and Service. Will definitely buy again from this vendor when it is time to restock. A 18 days ago anon ~5/5, 3~5 deals ","uk, usa philippines","worldwide"
"2014-12-08__WWVoFJtlX3.html","2014-12-08","Gotmilk","100 tabs-TAPENTADOL 100MG NUCYNTA RANBAXY/MSD $200 - same as oxycontin 20mg",0.55642109,200.8346282246,360.94,"Drugs","Opioids","Other"," Feedbacks: 5/5 FE is required and due to """"""""""""""""""""""""""""""""Gotmilk"""""""""""""""""""""""""""""""" reputation on here and other sites I FE'd ... Anyways """"""""""""""""""""""""""""""""Gotmilk"""""""""""""""""""""""""""""""" is an Excellent Seller, Rec 8 days ago anon 6~10 deals ","uk and ireland","no info"
"2014-12-08__xYcLVqJrbs.html","2014-12-08","accept","CANNABIS / BHO / WAX / OIL / SHATTER: 1/2g. 2-4 DAY MAIL",0.07545898,27.2361642412,360.94,"Drugs","Cannabis","Concentrates"," Feedbacks: 5/5 Received the package in 3 days. It was very stealthy. The product was a bit sticky, but the end result amazing. 2 days ago anon ~5/5, 10~15 deals ","uk, usa philippines","usa"
"2014-12-09__bxPEU7wBeu.html","2014-12-09","DutchTruthTeller","1G PERUVIAN COCAINE - UNCUT",0.2,70.254,351.27,"Drugs","Stimulants","Cocaine"," Feedbacks: 5/5 Really cool vendor. Stuff didnt arrive but gave me a 100% refund Dont know about the stuff but great service at all!! 24 days ago anon ~5/5, 10~15 deals ","uk, usa philippines","world  except australia"
"2014-12-09__CdVuwm4Wt5.html","2014-12-09","medibuds","Greenhouse LA Confidential  (1 ounce)",0.61470722,215.9282051694,351.27,"Drugs","Cannabis","Weed"," Feedbacks: 5/5 A classic strain, glad to see it around again!! medibuds kills this! amazing!! A++ 7 days ago anon 5.00/5, 70~100 deals ","uk, usa philippines","usa"
"2014-12-09__kblG8bRLd1.html","2014-12-09","DrDankBud","Custom - reapermadone",0.86315,303.1987005,351.27,"Drugs","Cannabis","Weed"," Feedbacks: 5/5 yeh dead cool,fast,much appreciated 215 days ago anon ~5/5, 25~40 deals ","uk, usa philippines","no info"
"2014-12-09__sjV0u4t7jy.html","2014-12-09","lamachine","5g ecstasy MDMA",0.42587019,149.5954216413,351.27,"Drugs","Ecstasy","MDMA"," Feedbacks: 5/5 Good receive and very good product,very friendly guy and very fast shipping.Man serious.Full confidence the eyes closed 102 days ago anon 5.00/5, 40~55 deals 5/5 Bien reçu. Envoi correctement discret. Merci ! 112 days ago anon ~5/5, 3~5 deals 5/5 113 days ago anon 6~10 deals 5/5 F.E j'ai le recu 2 jours apres j'avais fait la commande. Je revendirai . Quality 10/10 . Recommended for every french resident 114 days ago anon ~5/5, 3~5 deals 5/5 Toujours au top 115 days ago anon ~5/5, 6~10 deals 5/5 Super belle md avec de gros cristaux ocre...je reviendrai donner mon avis après le week-end...super seath 122 days ago anon 5.00/5, 40~55 deals 5/5 Excellent vendeur je recommande! 146 days ago anon 6~10 deals 5/5 nice quality, very fast delivery ! thank you 151 days ago anon 6~10 deals ","uk, usa philippines","franceance"
"2014-12-09__yg6zo9vfoC.html","2014-12-09","ShroomXpress","Oxycodone 10MG Tablets",0.28400215,99.7614352305,351.27,"Drugs","Opioids","Oxycodone"," Feedbacks: 5/5 Perfect thanks, fast delivery, good stealth 69 days ago anon 5.00/5, 25~40 deals 5/5 Perfect! Little expensive but great comms, quick postage and very much worth it. FE for this guy if you can. Really helped me o 76 days ago anon 5.00/5, 15~25 deals ","uk, usa philippines","no info"
"2014-12-10__U9mGSXpD9y.html","2014-12-10","dutchquality_1256","5 x180 Mg. Super PowerPill, Dutch Party pills",0.06901595,23.784276689,344.62,"Drugs","Ecstasy","Pills"," Feedbacks: 5/5 FE for trusted vendor, will update quality, stealth, overall experience when I receive my order. Can't wait till it arrives!!! 1 days ago anon 3~5 deals 5/5 THE TRUE KING 17 days ago anon 5.00/5, 25~40 deals 5/5 Danke für die zuverlässigkeit, kann diesen Anbieter nur empfehlen !!!! Jetz freu ich mich erst mal auf das Wochenende, wenn ic 143 days ago anon 5.00/5, 10~15 deals 5/5 173 days ago anon ~5/5, 15~25 deals ","uk, usa philippines","worldwide"
"2014-12-10__gCEGWwFTpt.html","2014-12-10","Drugs4you","Orange Hill, FREE SHIPPING / 10g / 0.35oz (FE required, with DISCOUNT)",0.48730149,167.9338394838,344.62,"Drugs","Cannabis","Weed"," Feedbacks: 5/5 80 days ago anon 5.00/5, 25~40 deals ","uk, usa philippines","no info"
"2014-12-10__JayrWKxLnc.html","2014-12-10","Premiumgear","100 Tabs Diazepam (Valium) 10mg/100 tabs",0.42675467,147.0681943754,344.62,"Drugs","Benzos","NA"," Feedbacks: 5/5 A+++++ FE early for trusted vendor!! 120 days ago anon ~5/5, 10~15 deals 5/5 5/5 would recommend vender to all ! Great stealth / great communication. All good in my book 187 days ago anon ~5/5, 6~10 deals 5/5 Quality product and service. No more Paki generics for me! Premiumgear is my choice! 192 days ago anon ~4/5, 15~25 deals ","uk, usa philippines","no info"
"2014-12-11__Pz9a3dcLtl.html","2014-12-11","vicious86","10 Easy touch 29 or 30 Gauge Syringes Works Gear !! Free Shipping",0.03382949,11.7432308637,347.13,"Drugs","Opioids","Heroin"," Feedbacks: 5/5 Shipping was prompt and only took 3 days from ordering to my door. Product is exactly as advertised. Ill return for sure. 2 days ago anon ~5/5, 10~15 deals 5/5 FE'd early! Will update! 7 days ago anon ~5/5, 6~10 deals 5/5 Better than Amazon Prime. What else need be said? 9 days ago anon 5.00/5, 100~150 deals 5/5 best communication ive ever seen. Amazing vendor. Pleasure to do biz with. 12 days ago anon 5.00/5, 15~25 deals 5/5 very smooooooth transaction. great vendor! 18 days ago anon ~5/5, 10~15 deals 5/5 Thank you! Everything perfect. This was a no worries order. 18 days ago anon ~5/5, 1~2 deals 5/5 FE'd for trust, I wasn't asked. I'm repeat business & He'll have my business forever if he wants it. 20 days ago anon ~5/5, 10~15 deals 5/5 Great stealth, fast delivery, will use again! 23 days ago anon ~5/5, 6~10 deals 5/5 Awesome vendor! Speedy and professional. 24 days ago anon ~5/5, 3~5 deals 5/5 Just as described. Quick. Sorry for late finalization. 30 days ago anon 5.00/5, 40~55 deals 5/5 Always reliable! 32 days ago anon ~5/5, 70~100 deals 5/5 Vicious gets you what you need. Overall great vendor. 33 days ago anon ~5/5, 1~2 deals 5/5 Vicious is my homeboy that always come through with the best priced cleans on the darknet. Professional and laid back this is m 34 days ago anon 5.00/5, 25~40 deals 5/5 great communication from a vendor that cares. will use again! 49 days ago anon ~5/5, 25~40 deals 5/5 Got exactly what I ordered. 50 days ago anon ~5/5, 10~15 deals 5/5 Got exactly what I ordered. 51 days ago anon ~5/5, 10~15 deals ","uk and ireland","usa"
"2014-12-11__vW0FFluwGu.html","2014-12-11","worldwideweed","14G Girl Scout Cookies TOP SHELF-ESCROW",0.34042553,118.1719142289,347.13,"Drugs","Cannabis","Weed"," Feedbacks: 5/5 WOW.. 10/10 product and shipping took 10 days to EU west. Great service, i will be back. Thank you WWW 1 days ago anon 6~10 deals 5/5 weed looks good high is nice shipping 2 weeks nice stealth 29 days ago anon 1~2 deals 5/5 A+++ Thanks WWW! 94 days ago anon ~5/5, 15~25 deals 5/5 Nice weed. Bit overpriced maybe. 2 weeks delivery. Decent stealth. 5/5 110 days ago anon 5.00/5, 100~150 deals 5/5 Came in 8 days domestic. Product is excellent quality. 118 days ago anon ~5/5, 25~40 deals 5/5 Within shipping times, smells amazing and undetectable from outside. Nugs compressed because of the bag but still nice. 122 days ago anon 6~10 deals 5/5 15 days to UK, nice stealth and nice weed. Cheers 125 days ago anon ~5/5, 40~55 deals 5/5 A+++ 150 days ago anon ~4/5, 15~25 deals 5/5 175 days ago anon ~5/5, 15~25 deals ","uk, usa philippines","worldwide"
"2014-12-12__c24fcynzfP.html","2014-12-12","DoctorNick","Suboxone 8mg Strips - 1x - Shipped from USA - No FE!",0.05037704,17.6793184176,350.94,"Drugs","Prescription","NA"," Feedbacks: 5/5 78 days ago anon 5.00/5, 55~70 deals ","uk, usa philippines","worldwide"
"2014-12-12__kWJiaMufsT.html","2014-12-12","cannabis-king","Power plant 10gr",0.31197708,109.4852364552,350.94,"Drugs","Cannabis","Weed"," Feedbacks: 5/5 Thank you, perfect. It's the real CK from SR2.. will def order again! 2 days ago anon 1~2 deals 5/5 Perfect! 2 days ago anon 1~2 deals 5/5 verschickt sehr schnell! unterstützt den mann! 8 days ago anon 6~10 deals 5/5 as always really fast shipping & great stealth! 9 days ago anon 1~2 deals 5/5 FE for trusted vendor from SR, glad to see you here. 11 days ago anon ~5/5, 15~25 deals 5/5 11 days ago anon 1~2 deals 5/5 perfect good sthealh good product as usual 15 days ago anon ~5/5, 3~5 deals 5/5 This is the King from SR, my order just came packaged like always. Awesome :) 19 days ago anon 1~2 deals 5/5 strong power plant, strong head high followed by exquisite body high. great for dancing and masturbation. 21 days ago anon ~5/5, 6~10 deals 5/5 Good Stealth, recieved as always, very quick (fr-mo - domestic), nice high. tagsüber optimal 24 days ago anon ~5/5, 3~5 deals ","uk, usa philippines","no info"
"2014-12-12__puYtGbREms.html","2014-12-12","carmexican","INTRO OFFER 2mg Xanax - Alprazolam tabs  50- minimum",0.00423358,1.4857325652,350.94,"Drugs","Benzos","NA"," Feedbacks: 5/5 AAA+ Great Stealth, High Quality Product, Shipping time was decent, Definitely will be back! Thank You!!! 75 days ago anon ~5/5, 15~25 deals 5/5 Wow! Well done sir or madam! 76 days ago anon ~5/5, 25~40 deals 5/5 great product, fast shipping 76 days ago anon ~5/5, 15~25 deals 5/5 Good shit, certainly around ~2mg each. Discreet as fuck too obv. Thanks! 81 days ago anon ~5/5, 15~25 deals 5/5 Finalizing early because I have a good feeling about this vendor and his prices kick ass. Can't wait to test! 87 days ago anon ~5/5, 40~55 deals 5/5 I love their mints they kick some serious ass and I have really bad anxiety these help a lot! 87 days ago anon 5.00/5, 150~200 deals 5/5 Great product, fast shipping. Would recommend to swallow em. If you suck it like a mint that bitter taste doesn't go away. 94 days ago anon ~4/5, 15~25 deals 5/5 AWESOME REAL DEAL, WAY DIFFERENT BUT STRAIT 94 days ago anon 5.00/5, 55~70 deals 5/5 Seriously impressive. Fresh breath and the ability to make coworkers nap on the job. Who's getting a promotion? YOU ARE! jk, sr 95 days ago anon ~5/5, 25~40 deals 5/5 legit.fast ship. melt fast/act fast. very unique. dose is=to a bar. A+ for originality 97 days ago anon 5.00/5, 40~55 deals 5/5 Just as described except they were not in altoids box but altoids only cost $1.25 > I was very satisfied and will order again 97 days ago anon ~5/5, 6~10 deals 5/5 5/5 just tried product def. feel it, even got extra. could have better stealth but still made it, all in all i would recommend 97 days ago anon ~5/5, 15~25 deals 5/5 Fast shipping, good stealth, potent product. Overall, very pleased with the vendor and the unique product. Will buy again. 98 days ago anon ~5/5, 6~10 deals ","uk, usa philippines","usa"
"2014-12-12__WYa9xNN6N8.html","2014-12-12","Organix2","Penis Envy spore print",0.08479846,29.7591715524,350.94,"Drugs","Psychedelics","Spores"," Feedbacks: 5/5 excellent vendor! 29 days ago anon 5.00/5, 15~25 deals 5/5 Exactly as described. Super fast delivery, two days to arrive. Great service will order again. 71 days ago anon 5.00/5, 25~40 deals ","uk, usa philippines","worldwide except australia"
